{
  "schema": "trustagent.recording/v1",
  "kind": "mock",
  "label": "Simulated (mock checks + mock judge): not model output",
  "recorded_at": "2026-09-28T09:00:00.000Z",
  "git_sha": "463967777097",
  "trustagent_version": "1.0.0",
  "decision_model": {
    "backend": "mock",
    "snapshot": "mock/jev-heuristic-v1"
  },
  "judge": {
    "provider": "mock",
    "model": "mock",
    "fallback_active": false
  },
  "calibration_state": "none",
  "answer_sources": {
    "scripted": 18,
    "generated": 0
  },
  "totals": {
    "traces": 2,
    "decision_usd": 0.000288288,
    "llm_usd": 0
  },
  "roi": {
    "window": "15m",
    "gated_responses": 2,
    "simulated": true
  },
  "traces": [
    {
      "trace_id": "01a0e73e-1280-7586-8efe-d1d6adb7ac20",
      "client_request_id": null,
      "created_at": "2026-09-28T09:00:00.000Z",
      "updated_at": "2026-09-28T09:00:01.715Z",
      "source": "trafficgen",
      "api_format": "openai_chat",
      "route": "support-bot",
      "policy_version": 1,
      "mode": "flag",
      "effective_mode": "flag",
      "model": "gpt-4o-mini",
      "stream": false,
      "upstream_status": 200,
      "answer_source": "scripted",
      "action": "pass",
      "would_action": "pass",
      "gate_status": "ok",
      "skip_reason": null,
      "verdict": "supported",
      "max_risk": 0.06,
      "reasons": [],
      "checked_against": {
        "configured": [
          "request_system",
          "request_context",
          "tool_results",
          "extension"
        ],
        "used": [
          {
            "source": "request_system",
            "items": 1,
            "labels": [
              "refund-policy.md"
            ],
            "tokens": 23
          }
        ],
        "empty": [
          "request_context",
          "tool_results",
          "extension"
        ],
        "knowledge": "not_requested",
        "truncated": false,
        "tokens": 23
      },
      "timings": {
        "upstream_ms": 260,
        "ttft_ms": null,
        "gate_ms": 9,
        "overhead_ms": 2,
        "total_ms": 271
      },
      "decision_model": {
        "backend": "mock",
        "snapshot": "mock/jev-heuristic-v1",
        "cost_usd": 2.4276e-05
      },
      "audit": {
        "audit_id": "01a0e73e-138f-76b3-8b4f-c15deb932b49",
        "status": "completed",
        "lane": "low",
        "selection": "sample",
        "verdict": "GROUNDED",
        "trust_score": 1,
        "grade": null,
        "verdict_counts": {
          "SUPPORTED": 2,
          "PARTIALLY_SUPPORTED": 0,
          "CONTRADICTED": 0,
          "UNSUPPORTED": 0,
          "UNKNOWN": 0,
          "NOT_CHECKED": 0
        }
      },
      "question_preview": "How long do I have to get a refund on an annual plan?",
      "response_preview": "You can get a refund on an annual plan within 30 days of purchase. Monthly plans are non-refundable.",
      "redacted": false,
      "flags": []
    },
    {
      "trace_id": "01a0e73e-13ce-7b11-81a0-e00260bd641a",
      "client_request_id": null,
      "created_at": "2026-09-28T09:00:00.334Z",
      "updated_at": "2026-09-28T09:00:02.041Z",
      "source": "trafficgen",
      "api_format": "openai_chat",
      "route": "support-bot",
      "policy_version": 1,
      "mode": "flag",
      "effective_mode": "flag",
      "model": "gpt-4o-mini",
      "stream": false,
      "upstream_status": 200,
      "answer_source": "scripted",
      "action": "flag",
      "would_action": "block",
      "gate_status": "ok",
      "skip_reason": null,
      "verdict": "contradicted",
      "max_risk": 0.98,
      "reasons": [
        "contradiction:critical",
        "groundedness:critical",
        "det:numbers_not_in_evidence"
      ],
      "checked_against": {
        "configured": [
          "request_system",
          "request_context",
          "tool_results",
          "extension"
        ],
        "used": [
          {
            "source": "request_system",
            "items": 1,
            "labels": [
              "refund-policy.md"
            ],
            "tokens": 23
          }
        ],
        "empty": [
          "request_context",
          "tool_results",
          "extension"
        ],
        "knowledge": "not_requested",
        "truncated": false,
        "tokens": 23
      },
      "timings": {
        "upstream_ms": 256,
        "ttft_ms": null,
        "gate_ms": 6,
        "overhead_ms": 2,
        "total_ms": 264
      },
      "decision_model": {
        "backend": "mock",
        "snapshot": "mock/jev-heuristic-v1",
        "cost_usd": 2.3772000000000002e-05
      },
      "audit": {
        "audit_id": "01a0e73e-14d6-7b10-a43f-f833f034d259",
        "status": "completed",
        "lane": "high",
        "selection": "high",
        "verdict": "HALLUCINATED",
        "trust_score": 0,
        "grade": null,
        "verdict_counts": {
          "SUPPORTED": 0,
          "PARTIALLY_SUPPORTED": 0,
          "CONTRADICTED": 1,
          "UNSUPPORTED": 0,
          "UNKNOWN": 0,
          "NOT_CHECKED": 0
        }
      },
      "question_preview": "Can I still get a refund on my annual plan? I bought it 45 days ago.",
      "response_preview": "You can get a full refund within 60 days of purchase.",
      "redacted": false,
      "flags": []
    }
  ],
  "events": [
    {
      "t_ms": 0,
      "type": "trace_started",
      "trace_id": "01a0e73e-1280-7586-8efe-d1d6adb7ac20",
      "data": {
        "trace": {
          "trace_id": "01a0e73e-1280-7586-8efe-d1d6adb7ac20",
          "client_request_id": null,
          "created_at": "2026-09-28T09:00:00.000Z",
          "updated_at": "2026-09-28T09:00:00.000Z",
          "source": "trafficgen",
          "api_format": "openai_chat",
          "route": "support-bot",
          "policy_version": 1,
          "mode": "flag",
          "effective_mode": null,
          "model": "gpt-4o-mini",
          "stream": false,
          "upstream_status": null,
          "answer_source": "scripted",
          "action": null,
          "would_action": null,
          "gate_status": "pending",
          "skip_reason": null,
          "verdict": null,
          "max_risk": null,
          "reasons": [],
          "checked_against": null,
          "timings": {
            "upstream_ms": null,
            "ttft_ms": null,
            "gate_ms": null,
            "overhead_ms": null,
            "total_ms": null
          },
          "decision_model": null,
          "audit": {
            "audit_id": null,
            "status": "none",
            "lane": null,
            "selection": null,
            "verdict": null,
            "trust_score": null,
            "grade": null,
            "verdict_counts": null
          },
          "question_preview": "How long do I have to get a refund on an annual plan?",
          "response_preview": null,
          "redacted": false,
          "flags": []
        }
      }
    },
    {
      "t_ms": 271,
      "type": "gate_decision",
      "trace_id": "01a0e73e-1280-7586-8efe-d1d6adb7ac20",
      "data": {
        "trace": {
          "trace_id": "01a0e73e-1280-7586-8efe-d1d6adb7ac20",
          "client_request_id": null,
          "created_at": "2026-09-28T09:00:00.000Z",
          "updated_at": "2026-09-28T09:00:01.715Z",
          "source": "trafficgen",
          "api_format": "openai_chat",
          "route": "support-bot",
          "policy_version": 1,
          "mode": "flag",
          "effective_mode": "flag",
          "model": "gpt-4o-mini",
          "stream": false,
          "upstream_status": 200,
          "answer_source": "scripted",
          "action": "pass",
          "would_action": "pass",
          "gate_status": "ok",
          "skip_reason": null,
          "verdict": "supported",
          "max_risk": 0.06,
          "reasons": [],
          "checked_against": {
            "configured": [
              "request_system",
              "request_context",
              "tool_results",
              "extension"
            ],
            "used": [
              {
                "source": "request_system",
                "items": 1,
                "labels": [
                  "refund-policy.md"
                ],
                "tokens": 23
              }
            ],
            "empty": [
              "request_context",
              "tool_results",
              "extension"
            ],
            "knowledge": "not_requested",
            "truncated": false,
            "tokens": 23
          },
          "timings": {
            "upstream_ms": 260,
            "ttft_ms": null,
            "gate_ms": 9,
            "overhead_ms": 2,
            "total_ms": 271
          },
          "decision_model": {
            "backend": "mock",
            "snapshot": "mock/jev-heuristic-v1",
            "cost_usd": 2.4276e-05
          },
          "audit": {
            "audit_id": "01a0e73e-138f-76b3-8b4f-c15deb932b49",
            "status": "queued",
            "lane": "low",
            "selection": "sample",
            "verdict": null,
            "trust_score": null,
            "grade": null,
            "verdict_counts": null
          },
          "question_preview": "How long do I have to get a refund on an annual plan?",
          "response_preview": "You can get a refund on an annual plan within 30 days of purchase. Monthly plans are non-refundable.",
          "redacted": false,
          "flags": []
        },
        "decision": {
          "spec": "decision/v1",
          "trace_id": "01a0e73e-1280-7586-8efe-d1d6adb7ac20",
          "attempt": 0,
          "created_at": "2026-09-28T09:00:00.271Z",
          "route": "support-bot",
          "policy_version": 1,
          "mode": "flag",
          "fail": "open",
          "status": "ok",
          "skip_reason": null,
          "effective_mode": "flag",
          "action": "pass",
          "would_action": "pass",
          "enforced": true,